<!--
<?xml-stylesheet type="text/xsl" href="xsl/voyages.xsl" ?>
<?xml-stylesheet type="text/xsl" href="xsl/clients.xsl" ?>
<?xml-stylesheet type="text/xsl" href="xsl/offres.xsl" ?>
-->
<?xml-stylesheet type="text/xsl" href="xsl/voyages.xsl" ?>

<Organisme
        xmlns:xsl="http://www.w3.org/2001/XMLSchema-instance"
        xsl:noNamespaceSchemaLocation="Organisme.xsd">
    <offres>
        <offre offreId="001">
            <type>Colonie de vacances</type>
            <destination>Barcelone, Espagne</destination>
            <ageMin>16</ageMin>
            <ageMax>20</ageMax>
            <prix>300</prix>
            <nombrePlaces>15</nombrePlaces>
            <duree>10</duree>
            <langue>
                <nom>Espagnol</nom>
                <niveauCours>Bon niveau (B2)</niveauCours>
                <heuresCours>40</heuresCours>
                <test>ELYTE</test>
            </langue>
        </offre>

        <offre offreId="002">
            <type>Colonie de vacances</type>
            <destination>Londres, Royaume Uni</destination>
            <ageMin>16</ageMin>
            <ageMax>21</ageMax>
            <prix>400</prix>
            <nombrePlaces>25</nombrePlaces>
            <duree>10</duree>
            <langue>
                <nom>Anglais</nom>
                <niveauCours>Bon niveau (B2)</niveauCours>
                <heuresCours>40</heuresCours>
                <test>TOEIC</test>
            </langue>
        </offre>

        <offre offreId="003">
            <type>Immersion en famille</type>
            <destination>Madrid, Espagne</destination>
            <ageMin>16</ageMin>
            <ageMax>25</ageMax>
            <prix>200</prix>
            <nombrePlaces>5</nombrePlaces>
            <duree>20</duree>
            <langue>
                <nom>Espagnol</nom>
                <niveauCours>Bon niveau (B2)</niveauCours>
                <heuresCours>60</heuresCours>
                <test>ELYTE</test>
            </langue>
        </offre>

        <offre offreId="004">
            <type>Voyage humanitaire</type>
            <destination>Nairobi, Kenya</destination>
            <ageMin>18</ageMin>
            <ageMax>25</ageMax>
            <prix>500</prix>
            <nombrePlaces>3</nombrePlaces>
            <duree>30</duree>
        </offre>

        <offre offreId="005">
            <type>Colonie de vacances</type>
            <destination>Amsterdam, Pays-Bas</destination>
            <ageMin>16</ageMin>
            <ageMax>22</ageMax>
            <prix>350</prix>
            <nombrePlaces>20</nombrePlaces>
            <duree>10</duree>
            <langue>
                <nom>Néerlandais</nom>
                <niveauCours>Débutant (A1)</niveauCours>
                <heuresCours>40</heuresCours>
                <test>NT2</test>
            </langue>
        </offre>

        <offre offreId="006">
            <type>Groupe scolaire</type>
            <destination>Berlin, Allemagne</destination>
            <ageMin>16</ageMin>
            <ageMax>22</ageMax>
            <prix>450</prix>
            <nombrePlaces>15</nombrePlaces>
            <duree>15</duree>
            <langue>
                <nom>Allemand</nom>
                <niveauCours>Bon niveau (B2)</niveauCours>
                <heuresCours>45</heuresCours>
                <test>Zertifikat Deutsch</test>
            </langue>
        </offre>

        <offre offreId="007">
            <type>Colonie de vacances</type>
            <destination>Séville, Espagne</destination>
            <ageMin>14</ageMin>
            <ageMax>18</ageMax>
            <prix>350</prix>
            <nombrePlaces>3</nombrePlaces>
            <duree>15</duree>
            <langue>
                <nom>Espagnol</nom>
                <niveauCours>Intermédiaire (B1)</niveauCours>
                <heuresCours>30</heuresCours>
                <test>ELYTE</test>
            </langue>
        </offre>

        <offre offreId="008">
            <type>Voyage humanitaire</type>
            <destination>New Delhi, Inde</destination>
            <ageMin>20</ageMin>
            <ageMax>30</ageMax>
            <prix>600</prix>
            <nombrePlaces>15</nombrePlaces>
            <duree>40</duree>
            <langue>
                <nom>Anglais</nom>
                <niveauCours>Bon niveau (B2)</niveauCours>
                <heuresCours>40</heuresCours>
                <test>TOEIC</test>
            </langue>
        </offre>

        <offre offreId="009">
            <type>Immersion en famille</type>
            <destination>Munich, Allemagne</destination>
            <ageMin>16</ageMin>
            <ageMax>20</ageMax>
            <prix>300</prix>
            <nombrePlaces>5</nombrePlaces>
            <duree>20</duree>
            <langue>
                <nom>Allemand</nom>
                <niveauCours>Intermédiaire (B1)</niveauCours>
                <heuresCours>40</heuresCours>
                <test>ZOP</test>
            </langue>
        </offre>

        <offre offreId="010">
            <type>Groupe scolaire</type>
            <destination>New York, Etats-Unis</destination>
            <ageMin>15</ageMin>
            <ageMax>18</ageMax>
            <prix>500</prix>
            <nombrePlaces>25</nombrePlaces>
            <duree>15</duree>
            <langue>
                <nom>Anglais</nom>
                <niveauCours>Intermédiaire (B1)</niveauCours>
                <heuresCours>70</heuresCours>
                <test>TOEFL</test>
            </langue>
        </offre>
    </offres>

    <activites>
        <activite activiteId="001">
            <type>Visite</type>
            <description>Visite de la Sagrada Familia avec un guide expérimenté.</description>
            <nombrePersonne>15</nombrePersonne>
            <duree>1</duree>
        </activite>

        <activite activiteId="002">
            <type>Sport</type>
            <description>Vous profiterez d'une heure de jetSki avec un accompagnateur.</description>
            <prix>50</prix>
            <nombrePersonne>10</nombrePersonne>
            <duree>1</duree>
        </activite>

        <activite activiteId="003">
            <type>Visite</type>
            <description>Excursion en bus pour visiter les plus beaux endroits de la ville.</description>
            <nombrePersonne>20</nombrePersonne>
            <duree>6</duree>
        </activite>

        <activite activiteId="004">
            <type>Sport</type>
            <description>Balade dans les campagnes proches de la ville avec un guide expérimenté.</description>
            <prix>20</prix>
            <nombrePersonne>12</nombrePersonne>
            <duree>4</duree>
        </activite>

        <activite activiteId="005">
            <type>Cours</type>
            <description>Apprenez à cuisiner les plats traditionnels avec un chef local.</description>
            <nombrePersonne>10</nombrePersonne>
            <duree>2</duree>
        </activite>

        <activite activiteId="006">
            <type>Visite</type>
            <description>Visite des sites historiques les plus importants de la ville de Rome, et visite du
                Colisée avec un guide expert.
            </description>
            <nombrePersonne>20</nombrePersonne>
            <duree>4</duree>
        </activite>

        <activite activiteId="007">
            <type>Volontariat</type>
            <description>Participez à des projets de volontariat pour aider les communautés locales. Vous
                participerez à l'aménagement d'une nouvelle école.
            </description>
            <prix>50</prix>
            <nombrePersonne>15</nombrePersonne>
            <duree>5</duree>
        </activite>

        <activite activiteId="008">
            <type>Sport</type>
            <description>Profitez d'une balade à vélo pour découvrir la ville sous un autre angle.</description>
            <prix>25</prix>
            <nombrePersonne>20</nombrePersonne>
            <duree>3</duree>
        </activite>

        <activite activiteId="009">
            <type>Visite</type>
            <description>Visite de l'Historisch Museum d'Amsterdam avec un guide local.</description>
            <nombrePersonne>20</nombrePersonne>
            <duree>2</duree>
        </activite>

        <activite activiteId="0010">
            <type>Sport</type>
            <description>Vous partirez pour une journée de randonnée avec un guide experimenté.</description>
            <nombrePersonne>8</nombrePersonne>
            <duree>8</duree>
        </activite>

    </activites>

    <utilisateurs>
        <clients>
            <client>
                <nom>Merckx</nom>
                <prenom>Aurélie</prenom>
                <age>19</age>

                <voyages>
                    <voyage voyageClientIdRef="001"/>
                </voyages>

                <contact>
                    <numeroTelephone>0612121212</numeroTelephone>
                    <adresse>664 route des trois moulins</adresse>
                    <ville>Antibes</ville>
                    <codePostale>06600</codePostale>
                    <adresseMail>aurelie.merckx@gmail.com</adresseMail>
                </contact>

                <contactUrgence>
                    <lien>Père</lien>
                    <nom>Merckx</nom>
                    <prenom>Pierre</prenom>
                    <numeroTelephone>0612121213</numeroTelephone>
                </contactUrgence>

                <langues>
                    <langue>
                        <nom>Espagnol</nom>
                        <niveau>Expérimenté (C1)</niveau>
                    </langue>
                    <langue>
                        <nom>Francais</nom>
                        <niveau>Langue Maternelle (C2)</niveau>
                    </langue>
                    <langue>
                        <nom>Anglais</nom>
                        <niveau>Bon niveau (B2)</niveau>
                    </langue>
                </langues>